{
  "chapter": "G07",
  "name": "方格城",
  "version": "V2.1",
  "protagonist": "星宇",
  "modules": {
    "场景流程": [
      {
        "场景ID": "SCN-G07-00",
        "场景名称": "错位城门",
        "地点": "方格城外门",
        "场景类型": "入场调查",
        "角色": "星宇、七码、规划员格格、居民小隅、结构师三角叔、夔",
        "核心目标": "完成错位城门的调查、找物、机制或权限目标",
        "下一场景": "SCN-G07-01",
        "存档点": "AUTO-G07-001",
        "关键道具": "模块图纸",
        "危险ID": "DANGER-032",
        "UI引用": "UI-032"
      },
      {
        "场景ID": "SCN-G07-01",
        "场景名称": "一格移动广场",
        "地点": "模块广场",
        "场景类型": "机制推进",
        "角色": "星宇、七码、规划员格格、居民小隅、结构师三角叔、夔",
        "核心目标": "完成一格移动广场的调查、找物、机制或权限目标",
        "下一场景": "SCN-G07-02",
        "存档点": "AUTO-G07-002",
        "关键道具": "空格标记",
        "危险ID": "DANGER-033",
        "UI引用": "UI-032"
      },
      {
        "场景ID": "SCN-G07-02",
        "场景名称": "最后一块空地",
        "地点": "城市规划厅",
        "场景类型": "找物与机制",
        "角色": "星宇、七码、规划员格格、居民小隅、结构师三角叔、夔",
        "核心目标": "完成最后一块空地的调查、找物、机制或权限目标",
        "下一场景": "SCN-G07-03",
        "存档点": "AUTO-G07-003",
        "关键道具": "公共通道牌",
        "危险ID": "DANGER-034",
        "UI引用": "UI-033"
      },
      {
        "场景ID": "SCN-G07-03",
        "场景名称": "公共通道争议",
        "地点": "居民巷道",
        "场景类型": "机制推进",
        "角色": "星宇、七码、规划员格格、居民小隅、结构师三角叔、夔",
        "核心目标": "完成公共通道争议的调查、找物、机制或权限目标",
        "下一场景": "SCN-G07-04",
        "存档点": "AUTO-G07-004",
        "关键道具": "应急空地旗",
        "危险ID": "DANGER-035",
        "UI引用": "UI-033"
      },
      {
        "场景ID": "SCN-G07-04",
        "场景名称": "封锁线测量",
        "地点": "震动边界区",
        "场景类型": "找物与机制",
        "角色": "星宇、七码、规划员格格、居民小隅、结构师三角叔、夔",
        "核心目标": "完成封锁线测量的调查、找物、机制或权限目标",
        "下一场景": "SCN-G07-05",
        "存档点": "AUTO-G07-005",
        "关键道具": "边界测绳",
        "危险ID": "DANGER-036",
        "UI引用": "UI-034"
      },
      {
        "场景ID": "SCN-G07-05",
        "场景名称": "震动重排",
        "地点": "重排核心",
        "场景类型": "剧情性失败/修正",
        "角色": "星宇、七码、规划员格格、居民小隅、结构师三角叔、夔",
        "核心目标": "完成震动重排的调查、找物、机制或权限目标",
        "下一场景": "SCN-G07-06",
        "存档点": "AUTO-G07-006",
        "关键道具": "封锁桩",
        "危险ID": "DANGER-037",
        "UI引用": "UI-034"
      },
      {
        "场景ID": "SCN-G07-06",
        "场景名称": "塔架加固",
        "地点": "中央塔架",
        "场景类型": "机制推进",
        "角色": "星宇、七码、规划员格格、居民小隅、结构师三角叔、夔",
        "核心目标": "完成塔架加固的调查、找物、机制或权限目标",
        "下一场景": "SCN-G07-07",
        "存档点": "AUTO-G07-007",
        "关键道具": "三角支撑杆",
        "危险ID": "DANGER-037",
        "UI引用": "UI-035"
      },
      {
        "场景ID": "SCN-G07-07",
        "场景名称": "夔权限解除",
        "地点": "地震控制塔",
        "场景类型": "管理员权限解除",
        "角色": "星宇、七码、规划员格格、居民小隅、结构师三角叔、夔",
        "核心目标": "完成夔权限解除的调查、找物、机制或权限目标",
        "下一场景": "SCN-G07-08",
        "存档点": "AUTO-G07-008",
        "关键道具": "节点扣",
        "危险ID": "DANGER-035/DANGER-036/DANGER-037",
        "UI引用": "UI-070"
      },
      {
        "场景ID": "SCN-G07-08",
        "场景名称": "城市恢复",
        "地点": "城市主轴",
        "场景类型": "世界改变/回访",
        "角色": "星宇、七码、规划员格格、居民小隅、结构师三角叔、夔",
        "核心目标": "完成城市恢复的调查、找物、机制或权限目标",
        "下一场景": "SCN-G07-09",
        "存档点": "AUTO-G07-009",
        "关键道具": "震动记录器",
        "危险ID": "无",
        "UI引用": "UI-071"
      },
      {
        "场景ID": "SCN-G07-09",
        "场景名称": "回访与结算",
        "地点": "公共空地",
        "场景类型": "世界改变/回访",
        "角色": "星宇、七码、规划员格格、居民小隅、结构师三角叔、夔",
        "核心目标": "完成回访与结算的调查、找物、机制或权限目标",
        "下一场景": "G08",
        "存档点": "AUTO-G07-010",
        "关键道具": "塔架铆钉",
        "危险ID": "无",
        "UI引用": "UI-071"
      }
    ],
    "热点清单": [
      {
        "热点ID": "HS-G07-0001",
        "场景ID": "SCN-G07-00",
        "热点名称": "错位城门-调查证据",
        "热点类型": "调查证据",
        "操作方式": "点击/扫描",
        "前置条件": "进入场景",
        "成功结果": "记录错位城门的关键证据",
        "错误反馈": "无",
        "完成后状态": "已读",
        "目标ID": "OBJ-G07-001"
      },
      {
        "热点ID": "HS-G07-0002",
        "场景ID": "SCN-G07-00",
        "热点名称": "错位城门-找物入口",
        "热点类型": "找物入口",
        "操作方式": "点击进入找物",
        "前置条件": "调查至少一项环境线索",
        "成功结果": "取得错位城门所需工具或证据",
        "错误反馈": "提示缩小范围",
        "完成后状态": "找物完成",
        "目标ID": "OBJ-G07-001"
      },
      {
        "热点ID": "HS-G07-0003",
        "场景ID": "SCN-G07-00",
        "热点名称": "错位城门-机制控制",
        "热点类型": "机制控制",
        "操作方式": "拖拽/排列/调整",
        "前置条件": "取得本场景关键道具",
        "成功结果": "推进错位城门对应机制状态",
        "错误反馈": "错误步骤退回或撤销最后一步",
        "完成后状态": "机制已验证",
        "目标ID": "OBJ-G07-001"
      },
      {
        "热点ID": "HS-G07-0004",
        "场景ID": "SCN-G07-00",
        "热点名称": "错位城门-完成确认",
        "热点类型": "完成确认",
        "操作方式": "提交/确认",
        "前置条件": "机制条件全部满足",
        "成功结果": "完成错位城门并开放下一节点",
        "错误反馈": "条件不足时拒绝提交",
        "完成后状态": "场景S5完成",
        "目标ID": "OBJ-G07-001"
      },
      {
        "热点ID": "HS-G07-0005",
        "场景ID": "SCN-G07-01",
        "热点名称": "一格移动广场-调查证据",
        "热点类型": "调查证据",
        "操作方式": "点击/扫描",
        "前置条件": "进入场景",
        "成功结果": "记录一格移动广场的关键证据",
        "错误反馈": "无",
        "完成后状态": "已读",
        "目标ID": "OBJ-G07-002"
      },
      {
        "热点ID": "HS-G07-0006",
        "场景ID": "SCN-G07-01",
        "热点名称": "一格移动广场-找物入口",
        "热点类型": "找物入口",
        "操作方式": "点击进入找物",
        "前置条件": "调查至少一项环境线索",
        "成功结果": "取得一格移动广场所需工具或证据",
        "错误反馈": "提示缩小范围",
        "完成后状态": "找物完成",
        "目标ID": "OBJ-G07-002"
      },
      {
        "热点ID": "HS-G07-0007",
        "场景ID": "SCN-G07-01",
        "热点名称": "一格移动广场-机制控制",
        "热点类型": "机制控制",
        "操作方式": "拖拽/排列/调整",
        "前置条件": "取得本场景关键道具",
        "成功结果": "推进一格移动广场对应机制状态",
        "错误反馈": "错误步骤退回或撤销最后一步",
        "完成后状态": "机制已验证",
        "目标ID": "OBJ-G07-002"
      },
      {
        "热点ID": "HS-G07-0008",
        "场景ID": "SCN-G07-01",
        "热点名称": "一格移动广场-完成确认",
        "热点类型": "完成确认",
        "操作方式": "提交/确认",
        "前置条件": "机制条件全部满足",
        "成功结果": "完成一格移动广场并开放下一节点",
        "错误反馈": "条件不足时拒绝提交",
        "完成后状态": "场景S5完成",
        "目标ID": "OBJ-G07-002"
      },
      {
        "热点ID": "HS-G07-0009",
        "场景ID": "SCN-G07-02",
        "热点名称": "最后一块空地-调查证据",
        "热点类型": "调查证据",
        "操作方式": "点击/扫描",
        "前置条件": "进入场景",
        "成功结果": "记录最后一块空地的关键证据",
        "错误反馈": "无",
        "完成后状态": "已读",
        "目标ID": "OBJ-G07-003"
      },
      {
        "热点ID": "HS-G07-0010",
        "场景ID": "SCN-G07-02",
        "热点名称": "最后一块空地-找物入口",
        "热点类型": "找物入口",
        "操作方式": "点击进入找物",
        "前置条件": "调查至少一项环境线索",
        "成功结果": "取得最后一块空地所需工具或证据",
        "错误反馈": "提示缩小范围",
        "完成后状态": "找物完成",
        "目标ID": "OBJ-G07-003"
      },
      {
        "热点ID": "HS-G07-0011",
        "场景ID": "SCN-G07-02",
        "热点名称": "最后一块空地-机制控制",
        "热点类型": "机制控制",
        "操作方式": "拖拽/排列/调整",
        "前置条件": "取得本场景关键道具",
        "成功结果": "推进最后一块空地对应机制状态",
        "错误反馈": "错误步骤退回或撤销最后一步",
        "完成后状态": "机制已验证",
        "目标ID": "OBJ-G07-003"
      },
      {
        "热点ID": "HS-G07-0012",
        "场景ID": "SCN-G07-02",
        "热点名称": "最后一块空地-完成确认",
        "热点类型": "完成确认",
        "操作方式": "提交/确认",
        "前置条件": "机制条件全部满足",
        "成功结果": "完成最后一块空地并开放下一节点",
        "错误反馈": "条件不足时拒绝提交",
        "完成后状态": "场景S5完成",
        "目标ID": "OBJ-G07-003"
      },
      {
        "热点ID": "HS-G07-0013",
        "场景ID": "SCN-G07-03",
        "热点名称": "公共通道争议-调查证据",
        "热点类型": "调查证据",
        "操作方式": "点击/扫描",
        "前置条件": "进入场景",
        "成功结果": "记录公共通道争议的关键证据",
        "错误反馈": "无",
        "完成后状态": "已读",
        "目标ID": "OBJ-G07-004"
      },
      {
        "热点ID": "HS-G07-0014",
        "场景ID": "SCN-G07-03",
        "热点名称": "公共通道争议-找物入口",
        "热点类型": "找物入口",
        "操作方式": "点击进入找物",
        "前置条件": "调查至少一项环境线索",
        "成功结果": "取得公共通道争议所需工具或证据",
        "错误反馈": "提示缩小范围",
        "完成后状态": "找物完成",
        "目标ID": "OBJ-G07-004"
      },
      {
        "热点ID": "HS-G07-0015",
        "场景ID": "SCN-G07-03",
        "热点名称": "公共通道争议-机制控制",
        "热点类型": "机制控制",
        "操作方式": "拖拽/排列/调整",
        "前置条件": "取得本场景关键道具",
        "成功结果": "推进公共通道争议对应机制状态",
        "错误反馈": "错误步骤退回或撤销最后一步",
        "完成后状态": "机制已验证",
        "目标ID": "OBJ-G07-004"
      },
      {
        "热点ID": "HS-G07-0016",
        "场景ID": "SCN-G07-03",
        "热点名称": "公共通道争议-完成确认",
        "热点类型": "完成确认",
        "操作方式": "提交/确认",
        "前置条件": "机制条件全部满足",
        "成功结果": "完成公共通道争议并开放下一节点",
        "错误反馈": "条件不足时拒绝提交",
        "完成后状态": "场景S5完成",
        "目标ID": "OBJ-G07-004"
      },
      {
        "热点ID": "HS-G07-0017",
        "场景ID": "SCN-G07-04",
        "热点名称": "封锁线测量-调查证据",
        "热点类型": "调查证据",
        "操作方式": "点击/扫描",
        "前置条件": "进入场景",
        "成功结果": "记录封锁线测量的关键证据",
        "错误反馈": "无",
        "完成后状态": "已读",
        "目标ID": "OBJ-G07-005"
      },
      {
        "热点ID": "HS-G07-0018",
        "场景ID": "SCN-G07-04",
        "热点名称": "封锁线测量-找物入口",
        "热点类型": "找物入口",
        "操作方式": "点击进入找物",
        "前置条件": "调查至少一项环境线索",
        "成功结果": "取得封锁线测量所需工具或证据",
        "错误反馈": "提示缩小范围",
        "完成后状态": "找物完成",
        "目标ID": "OBJ-G07-005"
      },
      {
        "热点ID": "HS-G07-0019",
        "场景ID": "SCN-G07-04",
        "热点名称": "封锁线测量-机制控制",
        "热点类型": "机制控制",
        "操作方式": "拖拽/排列/调整",
        "前置条件": "取得本场景关键道具",
        "成功结果": "推进封锁线测量对应机制状态",
        "错误反馈": "错误步骤退回或撤销最后一步",
        "完成后状态": "机制已验证",
        "目标ID": "OBJ-G07-005"
      },
      {
        "热点ID": "HS-G07-0020",
        "场景ID": "SCN-G07-04",
        "热点名称": "封锁线测量-完成确认",
        "热点类型": "完成确认",
        "操作方式": "提交/确认",
        "前置条件": "机制条件全部满足",
        "成功结果": "完成封锁线测量并开放下一节点",
        "错误反馈": "条件不足时拒绝提交",
        "完成后状态": "场景S5完成",
        "目标ID": "OBJ-G07-005"
      },
      {
        "热点ID": "HS-G07-0021",
        "场景ID": "SCN-G07-05",
        "热点名称": "震动重排-调查证据",
        "热点类型": "调查证据",
        "操作方式": "点击/扫描",
        "前置条件": "进入场景",
        "成功结果": "记录震动重排的关键证据",
        "错误反馈": "无",
        "完成后状态": "已读",
        "目标ID": "OBJ-G07-006"
      },
      {
        "热点ID": "HS-G07-0022",
        "场景ID": "SCN-G07-05",
        "热点名称": "震动重排-找物入口",